title,views,when
Ingraham: America needs to begin decoupling from China,51K views,8 days ago
NOT GOOD: China expert warns of Beiing's tactic to 'humiliate' US,90K views,11 days ago
China is ‘testing’ the Biden administration: Vivek Ramaswamy,107K views,12 days ago
China knows ‘no bounds’: Top Republican,13K views,3 weeks ago
Steve Hilton: FBI is operating as an enforcer of the Democratic Party's agenda,43K views,1 month ago
Trump official warns against China's global influence: 'They're relentless',43K views,1 month ago
China would attack American homeland 'massively' if war starts: Gen. Keane,841K views,1 month ago
Tudor Dixon: The Left Is Waging A War On Hot Chicks | Fox Across America,32K views,1 month ago
"Trump trolls 'Rob DeSanctimonious,' warns him about Marxist 'lunatics'",99K views,1 month ago
Ingraham: Trump is the only candidate with ‘credibility’,152K views,1 month ago
Durham report: Schiff staffer reportedly intimidated researcher over Trump-Russia ties,568K views,1 month ago
Steve Hilton: There is a war on our children,23K views,1 month ago
Steve Hilton: Extremist Democrats are neglecting this,28K views,1 month ago
'TREASONOUS CHARADE': Trump reacts to release of Durham report,704K views,1 month ago
Anderson Cooper ripped for 'condescending' message after Trump town hall,148K views,1 month ago
Joe Biden is enabling Hunter and it's sick: Sen. Johnson,101K views,1 month ago
Steve Hilton fact-checks Fauci: 'It all makes sense now',153K views,1 month ago
Hilton: Biden is pandering to the far-left climate zealots,19K views,2 months ago
'BOLD-FACED': Blinken accused of lying under oath to protect Hunter Biden,257K views,2 months ago
Hunter Biden accused of playing 'destitute' artist to lower child support payments,99K views,2 months ago
